{
  "id": "portrait-stack",
  "name": "Portrait, hero over stacked copy",
  "aspect": "4:5",
  "width": 1080,
  "height": 1350,
  "slots": [
    {
      "role": "hero",
      "kind": "image",
      "box": [
        0,
        0,
        1,
        0.5
      ]
    },
    {
      "role": "headline",
      "kind": "text",
      "box": [
        0.07,
        0.55,
        0.93,
        0.7
      ]
    },
    {
      "role": "subhead",
      "kind": "text",
      "box": [
        0.07,
        0.72,
        0.93,
        0.79
      ]
    },
    {
      "role": "cta",
      "kind": "text",
      "box": [
        0.07,
        0.84,
        0.43,
        0.92
      ]
    },
    {
      "role": "logo",
      "kind": "image",
      "box": [
        0.7,
        0.855,
        0.93,
        0.9
      ]
    }
  ]
}
