{
  "id": "centered-badge",
  "name": "Centered badge",
  "aspect": "1:1",
  "width": 1080,
  "height": 1080,
  "slots": [
    {
      "role": "hero",
      "kind": "image",
      "box": [
        0,
        0,
        1,
        1
      ]
    },
    {
      "role": "decoration",
      "kind": "shape",
      "box": [
        0.14,
        0.22,
        0.86,
        0.9
      ]
    },
    {
      "role": "headline",
      "kind": "text",
      "box": [
        0.2,
        0.3,
        0.8,
        0.55
      ]
    },
    {
      "role": "cta",
      "kind": "text",
      "box": [
        0.3,
        0.62,
        0.7,
        0.71
      ]
    },
    {
      "role": "logo",
      "kind": "image",
      "box": [
        0.4,
        0.78,
        0.6,
        0.83
      ]
    }
  ]
}
