{
  "id": "story-card",
  "name": "Story, full bleed with copy card",
  "aspect": "9:16",
  "width": 1080,
  "height": 1920,
  "slots": [
    {
      "role": "hero",
      "kind": "image",
      "box": [
        0,
        0,
        1,
        1
      ]
    },
    {
      "role": "decoration",
      "kind": "shape",
      "box": [
        0.06,
        0.52,
        0.94,
        0.94
      ]
    },
    {
      "role": "headline",
      "kind": "text",
      "box": [
        0.12,
        0.565,
        0.88,
        0.695
      ]
    },
    {
      "role": "subhead",
      "kind": "text",
      "box": [
        0.12,
        0.715,
        0.88,
        0.78
      ]
    },
    {
      "role": "cta",
      "kind": "text",
      "box": [
        0.12,
        0.825,
        0.5,
        0.88
      ]
    },
    {
      "role": "logo",
      "kind": "image",
      "box": [
        0.64,
        0.835,
        0.88,
        0.87
      ]
    }
  ]
}
