{
  "id": "hero-top",
  "name": "Hero top, text below",
  "aspect": "1:1",
  "width": 1080,
  "height": 1080,
  "slots": [
    {
      "role": "hero",
      "kind": "image",
      "box": [
        0,
        0,
        1,
        0.52
      ]
    },
    {
      "role": "headline",
      "kind": "text",
      "box": [
        0.07,
        0.57,
        0.93,
        0.72
      ]
    },
    {
      "role": "subhead",
      "kind": "text",
      "box": [
        0.07,
        0.735,
        0.86,
        0.795
      ]
    },
    {
      "role": "cta",
      "kind": "text",
      "box": [
        0.07,
        0.84,
        0.43,
        0.925
      ]
    },
    {
      "role": "logo",
      "kind": "image",
      "box": [
        0.7,
        0.865,
        0.93,
        0.915
      ]
    }
  ]
}
