{
  "id": "split-left",
  "name": "Image left, text right",
  "aspect": "1:1",
  "width": 1080,
  "height": 1080,
  "slots": [
    {
      "role": "hero",
      "kind": "image",
      "box": [
        0,
        0,
        0.46,
        1
      ]
    },
    {
      "role": "headline",
      "kind": "text",
      "box": [
        0.53,
        0.17,
        0.93,
        0.44
      ]
    },
    {
      "role": "subhead",
      "kind": "text",
      "box": [
        0.53,
        0.48,
        0.93,
        0.61
      ]
    },
    {
      "role": "cta",
      "kind": "text",
      "box": [
        0.53,
        0.66,
        0.93,
        0.75
      ]
    },
    {
      "role": "logo",
      "kind": "image",
      "box": [
        0.7,
        0.82,
        0.93,
        0.88
      ]
    }
  ]
}
